{
  "id": "2026-03-18",
  "language": "go",
  "difficulty": "medium",
  "code": "package main\nimport \"fmt\"\nfunc main() {\n  ch := make(chan int, 1)\n  ch <- 7\n  close(ch)\n  v, ok := <-ch\n  fmt.Println(v, ok)\n}",
  "options": [
    "0 false",
    "7 true",
    "7 false",
    "panic"
  ],
  "correctIndex": 1,
  "explanation": "The buffered value is still readable after close; ok is true for that value.",
  "category": "channels"
}
