{
  "id": "2026-03-20",
  "language": "javascript",
  "difficulty": "medium",
  "code": "console.log(1);\nPromise.resolve().then(() => console.log(2));\nconsole.log(3);",
  "options": [
    "1 2 3",
    "1 3 2",
    "2 1 3",
    "3 2 1"
  ],
  "correctIndex": 1,
  "explanation": "Promise callbacks run in the microtask queue after the current synchronous code.",
  "category": "async"
}
