{
  "id": "2026-02-17",
  "language": "python",
  "difficulty": "medium",
  "code": "def deco(fn):\n    def wrapper():\n        return fn() + 1\n    return wrapper\n\n@deco\ndef f():\n    return 4\n\nprint(f())",
  "options": [
    "4",
    "5",
    "6",
    "TypeError"
  ],
  "correctIndex": 1,
  "explanation": "The decorator replaces f with wrapper, which returns fn()+1.",
  "category": "decorators"
}
