{
  "id": "2026-03-09",
  "language": "go",
  "difficulty": "easy",
  "code": "package main\nimport \"fmt\"\nfunc main() {\n  s := make([]int, 2, 5)\n  fmt.Println(len(s), cap(s))\n}",
  "options": [
    "2 5",
    "5 2",
    "2 2",
    "5 5"
  ],
  "correctIndex": 0,
  "explanation": "make([]int, 2, 5) creates a slice with length 2 and capacity 5.",
  "category": "slices"
}
